"conversation_id_str","created_at","favorite_count","full_text","id_str","image_url","in_reply_to_screen_name","lang","location","quote_count","reply_count","retweet_count","tweet_url","user_id_str","username"
"1732801119364194719","Thu Dec 07 16:35:55 +0000 2023","2845","Emang boleh sekeren ini.. Meledakkkk https://t.co/3ZWzy8T8UD","1732801119364194719","https://pbs.twimg.com/ext_tw_video_thumb/1732800830510866436/pu/img/cC9_59vLUsSzYLKN.jpg","","in","","66","125","944","https://x.com/ekowboy2/status/1732801119364194719","1006827831995711488","ekowboy2"
"1732716981810589705","Thu Dec 07 13:19:31 +0000 2023","0","@peluruTTK Awokwokwok","1732751692360454291","","anakpeluru","in","","0","0","0","https://x.com/ekowboy2/status/1732751692360454291","1006827831995711488","ekowboy2"
"1732751028284760230","Thu Dec 07 13:16:52 +0000 2023","647","Ini cocok buat milenial &amp; gen z yg ngerasain biaya kuliah mahal kos-kosan mahal. AMIN punya formulanya.. #AMINAjaDulu https://t.co/LlQIl6zPJO","1732751028284760230","https://pbs.twimg.com/ext_tw_video_thumb/1732750261733761024/pu/img/YvkBfy2pVC3nwYCp.jpg","","in","","3","17","274","https://x.com/ekowboy2/status/1732751028284760230","1006827831995711488","ekowboy2"
"1732709985942225167","Thu Dec 07 10:33:47 +0000 2023","1931","Sikap partai pengusung Anies-Muhaimin kompak tolak Gubernur Jakarta ditunjuk presiden.. Memenangkan AMIN sama dengan menyelamatkan demokrasi!! https://t.co/M6E4v1LcYe","1732709985942225167","https://pbs.twimg.com/media/GAvSjLRasAAWwxR.jpg","","in","","4","143","823","https://x.com/ekowboy2/status/1732709985942225167","1006827831995711488","ekowboy2"
"1732683972113760309","Thu Dec 07 08:50:25 +0000 2023","1275","Keren banget Anies didebat anak muda soal IKN kalo paslon lain pasti sudah mencret-mencret.. Silahkan disimak https://t.co/dQKfoYzuzb","1732683972113760309","https://pbs.twimg.com/ext_tw_video_thumb/1732683479085903872/pu/img/XhLF_6xzNtJfKU4x.jpg","","in","","10","45","487","https://x.com/ekowboy2/status/1732683972113760309","1006827831995711488","ekowboy2"
"1732564216832508071","Thu Dec 07 05:25:30 +0000 2023","54","@pandji Kalo gak boleh disanggah bukan debat tapi berdoa..","1732632404236574973","","pandji","in","","0","15","4","https://x.com/ekowboy2/status/1732632404236574973","1006827831995711488","ekowboy2"
"1732631128505471452","Thu Dec 07 05:20:26 +0000 2023","392","Fokus utama AMIN memberikan rasa AMAN dg menghapus bullying anak &amp; kekerasan terhadap perempuan.. Setuju dg Cak Imin silahkan retweet!! https://t.co/kX6naJ9TQb","1732631128505471452","https://pbs.twimg.com/ext_tw_video_thumb/1732628627072897024/pu/img/MxrrDbc6ayWFf0Sp.jpg","","in","","1","2","162","https://x.com/ekowboy2/status/1732631128505471452","1006827831995711488","ekowboy2"
"1732568751948919089","Thu Dec 07 01:12:34 +0000 2023","1036","Cak imin: politik is jalan tol solusi menghadapi tantangan kaum muda Debat yang asyik Cak Imin Raffi Ahmad &amp; prof Mahfud btw Gibran kemana ya.. https://t.co/7gNUwJ2CRJ","1732568751948919089","https://pbs.twimg.com/ext_tw_video_thumb/1732563672659267584/pu/img/xQ3bzPb47rTgOYEk.jpg","","in","","7","167","301","https://x.com/ekowboy2/status/1732568751948919089","1006827831995711488","ekowboy2"
"1732558509894721570","Thu Dec 07 00:31:52 +0000 2023","2158","Adakah kejahatan yang lebih besar dari penegak hukum yang melanggar hukum itu sendiri.. Silahkan rakyat menilai!! https://t.co/UoXCuTZRYK","1732558509894721570","https://pbs.twimg.com/media/GAtIyGlaEAAE91y.jpg","","in","","18","94","1152","https://x.com/ekowboy2/status/1732558509894721570","1006827831995711488","ekowboy2"
"1732310021575417996","Wed Dec 06 08:04:28 +0000 2023","1749","Mantan menteri ESDM mengaku ditegur karena bongkar kasus papa minta saham.. Mantan Menag mengaku diberhentikan karena menolak bubarkan FPI.. Mantan ketua KPK mengaku ditegur karena usut kasus e-ktp.. Kok serem ya?? https://t.co/RuQRP63pNR","1732310021575417996","https://pbs.twimg.com/media/GApmyKEaQAANuPl.jpg","","in","","23","65","942","https://x.com/ekowboy2/status/1732310021575417996","1006827831995711488","ekowboy2"
"1732245497963016583","Wed Dec 06 03:48:04 +0000 2023","3416","Dulu beliau digeser diduga karena tolak proyek kereta cepat.. Yang setuju Ignasius Jonan lanjutkan transformasi kereta api silahkan retweet!! https://t.co/ZGc8Cu5gIt","1732245497963016583","https://pbs.twimg.com/media/GAosGYOasAAgFuB.jpg","","in","","11","66","1950","https://x.com/ekowboy2/status/1732245497963016583","1006827831995711488","ekowboy2"
"1732214579416178997","Wed Dec 06 01:45:13 +0000 2023","1930","Mendadak ketiduran demi selamatkan sang pangeran.. Silahkan rakyat menilai!! https://t.co/CDrjdIGYuO","1732214579416178997","https://pbs.twimg.com/media/GAoP-rWaUAAJ5nZ.jpg","","in","","25","321","879","https://x.com/ekowboy2/status/1732214579416178997","1006827831995711488","ekowboy2"
"1732033483105800563","Tue Dec 05 13:45:36 +0000 2023","698","Penghinaan Ade Armando ini berdampak tidak hanya ke PSI tapi ke Prabowo-Gibran &amp; partai pengusung ikut terseret.. Bakal jadi Ratna Sarumpaet jilid 2!! https://t.co/1BHoQRhppx","1732033483105800563","https://pbs.twimg.com/media/GAlrRhWbQAA5RUf.jpg","","in","","10","25","362","https://x.com/ekowboy2/status/1732033483105800563","1006827831995711488","ekowboy2"
"1731962691668034036","Tue Dec 05 09:04:18 +0000 2023","1625","Jakarta sudah berantakan sejak dipimpin PJ Gubernur yang ditunjuk langsung presiden &amp; ini akan berlanjut 10 jt warga Jakarta akan kehilangan hak suaranya.. Silahkan rakyat menilai!! https://t.co/1RQt8t5T5o","1731962691668034036","https://pbs.twimg.com/media/GAkq45PbcAE77Gu.jpg","","in","","29","122","836","https://x.com/ekowboy2/status/1731962691668034036","1006827831995711488","ekowboy2"
"1731917325224607892","Tue Dec 05 06:04:02 +0000 2023","2384","Ini jadi keresahan orang tua dengan maraknya kasus bullying di sekolah.. Sepakat dg pak Anies silahkan retweet!! https://t.co/69CpG3InC5","1731917325224607892","https://pbs.twimg.com/media/GAkBoPkbUAAQIni.jpg","","in","","16","258","1022","https://x.com/ekowboy2/status/1731917325224607892","1006827831995711488","ekowboy2"
"1731825714813685935","Tue Dec 05 00:00:00 +0000 2023","443","Tiba-tiba Fahri Hamzah bicara peristiwa Km 50 ngeri.. Ternyata di lubuk hatinya terdalam masih oposisi!! https://t.co/UXhWytEDeI","1731825714813685935","https://pbs.twimg.com/ext_tw_video_thumb/1731736505843130368/pu/img/6V4fTskHeUIXZq9q.jpg","","in","","3","22","198","https://x.com/ekowboy2/status/1731825714813685935","1006827831995711488","ekowboy2"
"1731621168854315385","Mon Dec 04 10:27:13 +0000 2023","3266","Jogja siaga satu ada yang coba mengusik keistimewaan DIY yang merupakan akar sejarah &amp; jati diri bangsa ini.. Salam persatuan  https://t.co/DSGHI8aGOk","1731621168854315385","https://pbs.twimg.com/ext_tw_video_thumb/1731615413975605248/pu/img/xnOLJiEIe3SYOaMy.jpg","","in","","38","311","1279","https://x.com/ekowboy2/status/1731621168854315385","1006827831995711488","ekowboy2"
"1731586273708843515","Mon Dec 04 08:08:33 +0000 2023","3457","PANAS!! Sri Sultan HB X tantang balik kader PSI ubah undang-undang keistimewaan Yogyakarta.. Silahkan rakyat menilai!! https://t.co/tHAVZDDttj","1731586273708843515","https://pbs.twimg.com/ext_tw_video_thumb/1731585981663596544/pu/img/jld7X9kRocukBqh4.jpg","","in","","38","237","1466","https://x.com/ekowboy2/status/1731586273708843515","1006827831995711488","ekowboy2"
"1731274061614059941","Sun Dec 03 11:27:56 +0000 2023","1675","Usulan 01 Capres tetap dihadirkan sbg audiens tdk ikut debat sama sekali Justru 02 yang mengusulkan tidak ada debat tapi hanya pemaparan visi-misi tanpa ada sanggahan antar paslon Silahkan rakyat menilai!! https://t.co/TyT4GZmaLH","1731274061614059941","https://pbs.twimg.com/media/GAa4lXybMAAoZEV.jpg","","in","","31","77","850","https://x.com/ekowboy2/status/1731274061614059941","1006827831995711488","ekowboy2"
"1731159937257259282","Sun Dec 03 03:54:27 +0000 2023","1756","Halo Bawaslu ini sudah terang-terangan!! https://t.co/RCdyEf5NIu","1731159937257259282","https://pbs.twimg.com/media/GAZQye3a4AAuY0I.jpg","","in","","51","212","864","https://x.com/ekowboy2/status/1731159937257259282","1006827831995711488","ekowboy2"
"1730975107299037324","Sat Dec 02 15:40:00 +0000 2023","109","Mau tanya sama rakyat Indonesia apa gak bosen ya lihat surat suara.. https://t.co/enW0Hlbn2k","1730975107299037324","https://pbs.twimg.com/media/GAWor7_bkAA6oT3.jpg","","in","","3","28","47","https://x.com/ekowboy2/status/1730975107299037324","1006827831995711488","ekowboy2"
"1730937082464604254","Sat Dec 02 13:08:54 +0000 2023","2339","Untuk menumbangkan politik dinasti ternyata cukup perlihatkan rekam jejak pendukungnya.. Awokwokwok https://t.co/De4HQfCxlP","1730937082464604254","https://pbs.twimg.com/media/GAWGGmKaQAA7B1S.jpg","","in","","10","130","877","https://x.com/ekowboy2/status/1730937082464604254","1006827831995711488","ekowboy2"
"1730886298351944146","Sat Dec 02 12:05:41 +0000 2023","0","@peluruTTK Jadi karena keistimewaan Yogyakarta masih dipimpin sultan maka politik dinasti menjadi sah ini sih logikanya tengkurap!!","1730921175898055122","","anakpeluru","in","","0","1","0","https://x.com/ekowboy2/status/1730921175898055122","1006827831995711488","ekowboy2"
"1730884398550290453","Sat Dec 02 09:39:33 +0000 2023","4383","Cak Imin &amp; prof Mahfud kompak ingin debat cawapres tetap diadakan.. Jadi kira-kira siapa yg takut debat!! https://t.co/ATLghbdkGj","1730884398550290453","https://pbs.twimg.com/ext_tw_video_thumb/1730883659027374080/pu/img/Y0vi442E4Erb83yb.jpg","","in","","97","230","1734","https://x.com/ekowboy2/status/1730884398550290453","1006827831995711488","ekowboy2"
"1730846106316378408","Sat Dec 02 07:38:16 +0000 2023","441","@PartaiSocmed Nyoh.. https://t.co/pooR3sUjMp","1730853878109970645","","PartaiSocmed","in","","7","86","107","https://x.com/ekowboy2/status/1730853878109970645","1006827831995711488","ekowboy2"
"1730852166615855305","Sat Dec 02 07:31:28 +0000 2023","1359","Ini bukan hoax!! ada simbol pelangi di materi kampanye gemoy diposting dpc Gerindra Jepara cukup tau aja.. https://t.co/pkxKc6JVAP","1730852166615855305","https://pbs.twimg.com/ext_tw_video_thumb/1730851453693280256/pu/img/TkCSYvq_zYlgxgIj.jpg","","in","","129","184","649","https://x.com/ekowboy2/status/1730852166615855305","1006827831995711488","ekowboy2"
"1730834179976548611","Sat Dec 02 06:20:00 +0000 2023","2788","Batas usia diterabas Boleh bagi-bagi makanan Walikota tdk perlu mundur Format debat diubah Silahkan rakyat menilai!! https://t.co/8PmxZtq6bK","1730834179976548611","https://pbs.twimg.com/media/GAUog4dbwAArRiX.jpg","","in","","77","242","1650","https://x.com/ekowboy2/status/1730834179976548611","1006827831995711488","ekowboy2"
"1730751009826447422","Sat Dec 02 00:49:31 +0000 2023","3332","Debat yang diundang kampus kabur &amp; debat khusus cawapres ditiadakan KPU.. Terasa sekali wasit memihak!! https://t.co/XqpVf4HHTp","1730751009826447422","https://pbs.twimg.com/media/GATc3xuagAAkSX3.jpg","","in","","87","521","1226","https://x.com/ekowboy2/status/1730751009826447422","1006827831995711488","ekowboy2"
"1730619686151496092","Fri Dec 01 16:07:41 +0000 2023","1236","Tujuan debat khusus cawapres agar rakyat tau kualitas pemimpinnya karena selama ini cuma jadi ban serep Makin nyata demi siapakah aturan ini diubah silahkan rakyat menilai!! https://t.co/hfHoVB6Ruf","1730619686151496092","https://pbs.twimg.com/media/GARlbu4bgAAnX-c.jpg","","in","","34","105","627","https://x.com/ekowboy2/status/1730619686151496092","1006827831995711488","ekowboy2"
"1730133260091720165","Thu Nov 30 07:54:48 +0000 2023","1949","Kampanye bagi-bagi makanan hanya dilakukan oleh pemimpin dg gagasan kerdil krn merendahkan rakyat dg eksploitasi kemiskinan.. Setuju silahkan retweet!! https://t.co/hTktlejP18","1730133260091720165","https://pbs.twimg.com/media/GAKrCAhaQAAub9x.jpg","","in","","50","258","1402","https://x.com/ekowboy2/status/1730133260091720165","1006827831995711488","ekowboy2"
"1730071300960612777","Thu Nov 30 03:48:35 +0000 2023","1331","Pesannya jelas bahwa rakyat muak dengan praktek politik dinasti yang mengancam demokrasi.. Silahkan rakyat menilai!! https://t.co/SCd1l2wkzM","1730071300960612777","https://pbs.twimg.com/media/GAJyrfOb0AAT59i.jpg","","in","","10","50","567","https://x.com/ekowboy2/status/1730071300960612777","1006827831995711488","ekowboy2"
"1730050343688712658","Thu Nov 30 02:25:19 +0000 2023","2001","Haris dituntut 4 tahun &amp; Fatia dituntut 3 5 tahun atas kasus pencemaran lord Luhut Ternyata banyak loh mas Kaesang korbannya yang diancam bui karena kritis.. https://t.co/mkjWtn06aW","1730050343688712658","https://pbs.twimg.com/media/GAJdHuvaAAAwpcX.jpg","","in","","20","56","901","https://x.com/ekowboy2/status/1730050343688712658","1006827831995711488","ekowboy2"
"1729906630161264837","Wed Nov 29 16:54:15 +0000 2023","4220","Ini kocak Kaesang tanya yang menghina presiden ada yang ditangkap gak?? dijawab timnya sendiri ditangkap!! Awokwokwok.. https://t.co/EUAbJ8c1wP","1729906630161264837","https://pbs.twimg.com/ext_tw_video_thumb/1729903774855262209/pu/img/RbxBxGswDBivDsX_.jpg","","in","","461","863","1677","https://x.com/ekowboy2/status/1729906630161264837","1006827831995711488","ekowboy2"
"1729838753588396103","Wed Nov 29 12:24:32 +0000 2023","1058","Vonis 5 tahun penjara menjalani hukuman cuma 3 tahun bebas bersyarat &amp; dapat potongan remisi 7 5 bulan.. Koruptor makin berjaya Silahkan rakyat menilai!! https://t.co/T6d6rs3Sq8","1729838753588396103","https://pbs.twimg.com/media/GAGfLcTbMAAGZt6.jpg","","in","","20","107","657","https://x.com/ekowboy2/status/1729838753588396103","1006827831995711488","ekowboy2"
"1729760809931465039","Wed Nov 29 10:14:52 +0000 2023","134","@jokowi Yang gak boleh membangun kkn ","1729806123819999386","","jokowi","in","","0","7","4","https://x.com/ekowboy2/status/1729806123819999386","1006827831995711488","ekowboy2"
"1729701882799493437","Wed Nov 29 03:20:39 +0000 2023","284","Bagi-bagi sembako uang barang atau makanan adalah praktik vote buying termasuk pelanggan pemilu.. Silahkan rakyat menilai!! https://t.co/cJirV5qqKs","1729701882799493437","https://pbs.twimg.com/media/GAEisffbMAAm6bS.jpg","","in","","2","107","147","https://x.com/ekowboy2/status/1729701882799493437","1006827831995711488","ekowboy2"
"1729660528228786685","Wed Nov 29 00:36:20 +0000 2023","5310","Jangan biarkan Haris &amp; Fatia berjuang sendirian mereka gak layak dipenjara hanya karena bersuara kritis.. Selamatkan demokrasi lawan politik dinasti!! https://t.co/OpGNPp39H3","1729660528228786685","https://pbs.twimg.com/ext_tw_video_thumb/1729655836656734208/pu/img/qbVkfaKjYhg9XgZS.jpg","","in","","22","58","2304","https://x.com/ekowboy2/status/1729660528228786685","1006827831995711488","ekowboy2"
"1729531522313793814","Tue Nov 28 16:03:42 +0000 2023","668","Debat panas.. Deddy Sitorus vs Fahri hamzah Dunia sudah kebalik-balik sang singa podium kini jadi pemuja dinasti miris!! https://t.co/aNSbrWVKNs","1729531522313793814","https://pbs.twimg.com/ext_tw_video_thumb/1729527091560075264/pu/img/WDVbbjBOUklKZGOW.jpg","","in","","10","74","354","https://x.com/ekowboy2/status/1729531522313793814","1006827831995711488","ekowboy2"
"1729449186314068260","Tue Nov 28 11:10:09 +0000 2023","89","@Dennysiregar7 Lagi musim catut-mencatut banyak yg kegocek.. https://t.co/jygnSi975O","1729457645420191891","","Dennysiregar7","in","","0","24","12","https://x.com/ekowboy2/status/1729457645420191891","1006827831995711488","ekowboy2"
"1729448033744757211","Tue Nov 28 10:31:57 +0000 2023","2725","Pledoi Haris Azhar: rezim penguasa ini mirip orde baru membangun manipulasi pada masyarakat.. Silahkan rakyat menilai!! https://t.co/J1EcqKPL7G","1729448033744757211","https://pbs.twimg.com/ext_tw_video_thumb/1729438304599519232/pu/img/99-zf32FAD1DpQlA.jpg","","in","","23","57","1318","https://x.com/ekowboy2/status/1729448033744757211","1006827831995711488","ekowboy2"
"1729433441828286754","Tue Nov 28 09:33:58 +0000 2023","268","Jejak digital komisaris Pelni ini belum dihapus serem-serem apa masih berlaku?? https://t.co/ip2qzsPILZ","1729433441828286754","https://pbs.twimg.com/media/GAAujNsbcAA0Y0m.jpg","","in","","3","17","171","https://x.com/ekowboy2/status/1729433441828286754","1006827831995711488","ekowboy2"
"1729381742530945467","Tue Nov 28 06:08:32 +0000 2023","989","Miris ya anggaran pilpres capai 76 6 T tapi ada paslon takut debat dg mahasiswa &amp; rakyatnya sendiri.. Silahkan rakyat menilai!! https://t.co/SAbkcN0mss","1729381742530945467","https://pbs.twimg.com/media/F___h41bQAAW9X3.jpg","","in","","5","45","452","https://x.com/ekowboy2/status/1729381742530945467","1006827831995711488","ekowboy2"
"1729288997371781187","Tue Nov 28 00:00:00 +0000 2023","1668","Di putaran kedua siapapun yang lolos kedua poros tokoh bangsa ini harus bersatu melawan dinasti politik demi masa depan cucu cicit kita Komitmen ini harus dirawat oleh para pendukungnya.. https://t.co/MqPWcapmGO","1729288997371781187","https://pbs.twimg.com/media/F_9Ne68agAA8KDs.jpg","","in","","36","618","579","https://x.com/ekowboy2/status/1729288997371781187","1006827831995711488","ekowboy2"
"1728987731072823350","Mon Nov 27 04:02:52 +0000 2023","1293","Rakyat dipaksa menerima putusan MK yang cacat hukum tapi mantan ketua MK sendiri gak terima dg putusan MKMK.. Silahkan rakyat menilai!! https://t.co/pfzSSneolh","1728987731072823350","https://pbs.twimg.com/media/F_6ZLaaaAAA00Ns.jpg","","in","","12","76","621","https://x.com/ekowboy2/status/1728987731072823350","1006827831995711488","ekowboy2"
"1728398482594263499","Mon Nov 27 03:34:13 +0000 2023","1","@peluruTTK Lebih baik menang curang daripada kalah terhormat prinsip tak bermoral..","1728980520074408241","","anakpeluru","in","","0","0","1","https://x.com/ekowboy2/status/1728980520074408241","1006827831995711488","ekowboy2"
"1728953331438219334","Mon Nov 27 03:10:34 +0000 2023","85","@gm_gm Tidak ada kata terlambat jangan sampai anak cucu kita menanggung ketidakpedulian kita lawan politik dinasti..","1728974567312707686","","gm_gm","in","","0","1","5","https://x.com/ekowboy2/status/1728974567312707686","1006827831995711488","ekowboy2"
"1728966877706399960","Mon Nov 27 02:40:00 +0000 2023","145","Harus diakui pendukung Anies sering bikin blunder &amp; itu dibiarkan padahal dampak elektoralnya cukup serius gak belajar dari kasus ratna sarumpaet.. https://t.co/8CsQaJrdAX","1728966877706399960","https://pbs.twimg.com/media/F_6GNllaUAAS8A7.jpg","","in","","1","15","51","https://x.com/ekowboy2/status/1728966877706399960","1006827831995711488","ekowboy2"
"1728756815511642277","Sun Nov 26 12:45:18 +0000 2023","1891","Ekspektasi rakyat ketika ada anak muda maka pilpres akan jadi arena adu gagasan.. tapi realitanya cuma Awokwokwok gak usah ditanggapi senyumin aja diajak debat takut!! https://t.co/wRvOL4SeVm","1728756815511642277","https://pbs.twimg.com/media/F_3HKZaawAAk-pG.jpg","","in","","43","311","599","https://x.com/ekowboy2/status/1728756815511642277","1006827831995711488","ekowboy2"
"1728712588920541594","Sun Nov 26 09:49:33 +0000 2023","2118","Tim Anies-Muhaimin &amp; Tim Ganjar-Mahfud penuhi undangan dialog bertajuk HAM sementara Prabowo-Gibran tidak hadir.. Silahkan rakyat menilai!! https://t.co/WUwSAszL20","1728712588920541594","https://pbs.twimg.com/media/F_2e8FCbsAAN0TL.jpg","","in","","39","201","1064","https://x.com/ekowboy2/status/1728712588920541594","1006827831995711488","ekowboy2"
"1728567996304797933","Sun Nov 26 00:15:00 +0000 2023","403","Sudah ada 2 lembaga survei yang menempatkan gemoy di atas 50% ini akan berlanjut menggiring opini sekenario untuk menang satu putaran.. Silahkan rakyat menilai!! https://t.co/XtS88Fei80","1728567996304797933","https://pbs.twimg.com/media/F_0X984asAAV8o6.jpg","","in","","22","151","181","https://x.com/ekowboy2/status/1728567996304797933","1006827831995711488","ekowboy2"
"1728557832604434628","Sat Nov 25 23:34:37 +0000 2023","184","Apa ya kelebihannya selain beliau anak presiden diundang debat gak dateng apalagi adu program nyontek program bapaknya..","1728557832604434628","","","in","","0","7","67","https://x.com/ekowboy2/status/1728557832604434628","1006827831995711488","ekowboy2"
"1728414748860154021","Sat Nov 25 14:06:03 +0000 2023","347","Mau tanya sama mantan aktivis 98 yg kini dukung praktek nepotisme.. Apa kalian gak merasa berdosa sama mbah Harto dulu dilengserkan dg alasan yg sama!! https://t.co/gPs8GDm7F8","1728414748860154021","https://pbs.twimg.com/media/F_yQDd0aYAA_LKU.jpg","","in","","3","13","153","https://x.com/ekowboy2/status/1728414748860154021","1006827831995711488","ekowboy2"
"1728353715391025187","Sat Nov 25 10:03:31 +0000 2023","734","Jarang tampil di acara uji publik bahkan cawapresnya gak pernah muncul tapi surveinya selalu tinggi &amp; gak masuk akal.. Silahkan rakyat menilai!! https://t.co/JnBQNO8Og6","1728353715391025187","https://pbs.twimg.com/media/F_xYi46aoAA3IwY.jpg","","in","","11","30","385","https://x.com/ekowboy2/status/1728353715391025187","1006827831995711488","ekowboy2"
"1728308348037239234","Sat Nov 25 07:03:15 +0000 2023","890","Ini sih nyindir istri paduka Awokwokwok.. https://t.co/k8oaWBO7ER","1728308348037239234","https://pbs.twimg.com/media/F_wvSJDbsAAm6u9.jpg","","in","","7","43","359","https://x.com/ekowboy2/status/1728308348037239234","1006827831995711488","ekowboy2"
"1728291464818618553","Sat Nov 25 05:56:09 +0000 2023","896","Gemoy akan sulit dikalahkan jika pendukung Anies &amp; Ganjar masih saling serang fokus jadikan politik dinasti sbg musuh bersama.. Ini tragedi bagi demokrasi!! #KamiMuak https://t.co/JK9MTN0hSX","1728291464818618553","https://pbs.twimg.com/media/F_wf7YsaoAAxoQ3.jpg","","in","","6","157","278","https://x.com/ekowboy2/status/1728291464818618553","1006827831995711488","ekowboy2"
"1728220061058617611","Sat Nov 25 01:12:25 +0000 2023","868","Survei gemoy capai 51% ini penghinaan terhadap akal sehat sama saja menganggap masyarakat kita masih feodal &amp; terbelakang mengamini dinasti politik!! https://t.co/hetYkEmMgk","1728220061058617611","https://pbs.twimg.com/media/F_ve_Gya0AA9sKL.jpg","","in","","22","177","261","https://x.com/ekowboy2/status/1728220061058617611","1006827831995711488","ekowboy2"
"1728059855934574708","Fri Nov 24 14:35:50 +0000 2023","1442","Anies-Muhaimin &amp; Ganjar-Mahfud penuhi undangan GagasRI di Unair sementara Prabowo-Gibran tidak hadir.. Silahkan rakyat menilai!! https://t.co/CkRRRxdzUT","1728059855934574708","https://pbs.twimg.com/media/F_tNR_1bYAEnX2b.jpg","","in","","32","211","701","https://x.com/ekowboy2/status/1728059855934574708","1006827831995711488","ekowboy2"
"1728003532018901375","Fri Nov 24 10:52:01 +0000 2023","1249","Kalo masih punya rasa malu mestinya mundur menyesal &amp; minta maaf.. Silahkan rakyat menilai!! https://t.co/NrH9UX0GBD","1728003532018901375","https://pbs.twimg.com/media/F_saDf4bEAA1AAa.jpg","","in","","19","74","689","https://x.com/ekowboy2/status/1728003532018901375","1006827831995711488","ekowboy2"
"1727940327791808891","Fri Nov 24 06:40:52 +0000 2023","259","Tenang saja pak saya sudah ada di sini senyumin aja jogetin aja.. https://t.co/6HHPjZ8yBU","1727940327791808891","https://pbs.twimg.com/media/F_rgkiNbAAAGwvG.jpg","","in","","5","69","90","https://x.com/ekowboy2/status/1727940327791808891","1006827831995711488","ekowboy2"
"1727858161468776776","Fri Nov 24 01:14:22 +0000 2023","1365","Ini ada benernya Anies-Muhaimin &amp; Ganjar-Mahfud sudah sering bicara di publik plus minusnya rakyat sudah tau.. Tapi anak muda yang luar biasa itu tidak pernah diuji isi pikirannya silahkan rakyat menilai!! https://t.co/LK6ZHZsnXg","1727858161468776776","https://pbs.twimg.com/ext_tw_video_thumb/1727857851048284160/pu/img/Nxy9tz73JV4Jmpi2.jpg","","in","","29","120","707","https://x.com/ekowboy2/status/1727858161468776776","1006827831995711488","ekowboy2"
"1727713288400564267","Thu Nov 23 15:38:41 +0000 2023","603","Ini metode uji publik yg disahkan MK meski tdk ada kewajiban tapi rakyat tentu dirugikan.. Alasan tidak hadirnya apa ya padahal dari kemarin nantangin adu gagasan kok acara desa bisa hadir?? https://t.co/zDCf07DsgA","1727713288400564267","https://pbs.twimg.com/media/F_oSFEeb0AAXpcU.jpg","","in","","7","47","267","https://x.com/ekowboy2/status/1727713288400564267","1006827831995711488","ekowboy2"
"1727665175279603854","Thu Nov 23 12:27:30 +0000 2023","3047","Sepakat dg Novel Baswedan &amp; Abraham Samad demi menyelamatkan marwah KPK segera tangkap &amp; usut tuntas dugaan kejahatan Firli lainnya.. Bangsa ini sedang tdk baik-baik saja!! https://t.co/nsp0f9aDpY","1727665175279603854","https://pbs.twimg.com/ext_tw_video_thumb/1727661646850727936/pu/img/Ks-QUV2uJW7itQiS.jpg","","in","","13","19","1316","https://x.com/ekowboy2/status/1727665175279603854","1006827831995711488","ekowboy2"
"1727618797866254683","Thu Nov 23 09:23:13 +0000 2023","3523","Ketua MK pelanggar etik berat Ketua KPK tersangka pemerasan Wamenkumham tersangka suap Anggota BPK tersangka BTS Itulah mengapa rakyat inginkan perubahan!! https://t.co/Sax1TtsL6p","1727618797866254683","https://pbs.twimg.com/media/F_m8JAba0AAahPN.jpg","","in","","48","337","1600","https://x.com/ekowboy2/status/1727618797866254683","1006827831995711488","ekowboy2"
"1727586383139573840","Thu Nov 23 07:14:25 +0000 2023","823","Firli Bahuri masih aktif menjadi ketua KPK &amp; pimpinan KPK menyatakan tidak merasa malu serta tidak akan meminta maaf.. Silahkan rakyat menilai!! https://t.co/mfjptWp9GV","1727586383139573840","https://pbs.twimg.com/ext_tw_video_thumb/1727585127436636160/pu/img/5hpbEhIL4mp8OIU3.jpg","","in","","40","197","497","https://x.com/ekowboy2/status/1727586383139573840","1006827831995711488","ekowboy2"
