"conversation_id_str","created_at","favorite_count","full_text","id_str","image_url","in_reply_to_screen_name","lang","location","quote_count","reply_count","retweet_count","tweet_url","user_id_str","username"
"1747900323250012570","Thu Jan 18 08:34:46 +0000 2024","362","Kreativitas adalah industri yg sumber dayanya tidak pernah habis.. Negara yg tdk mengembangkan industri kreatif &amp; hanya mengandalkan SDA lambat laun akan bangkrut!! #IndustriKreatifAMIN https://t.co/R5H7EblafH","1747900323250012570","https://pbs.twimg.com/ext_tw_video_thumb/1747899677067067392/pu/img/NNuyy-yLOEMh4Cmt.jpg","","in","","2","3","123","https://x.com/ekowboy2/status/1747900323250012570","1006827831995711488","ekowboy2"
"1747894729113763977","Thu Jan 18 08:12:32 +0000 2024","2317",": Sabar ya kalo sudah ada kewenangan kita kembalikan yang sudah seharusnya negara ini tidak boleh zolim sama rakyatnya.. #NakesDesakAnies https://t.co/Na5x9YbnI1","1747894729113763977","https://pbs.twimg.com/ext_tw_video_thumb/1747835484100079616/pu/img/YfOxF51rBno4QN3v.jpg","","in","","7","14","610","https://x.com/ekowboy2/status/1747894729113763977","1006827831995711488","ekowboy2"
"1747834002206269752","Thu Jan 18 04:11:13 +0000 2024","2263","Anies ditreat jadi idola beneran dong kampanye begini asik bangettt..","1747834002206269752","","","in","","503","15","625","https://x.com/ekowboy2/status/1747834002206269752","1006827831995711488","ekowboy2"
"1747666356642996305","Wed Jan 17 17:05:04 +0000 2024","3368","Anies paling fasih bicara anti-korupsi karena pernah menjabat ketua komisi etik KPK &amp; menyabet sekaligus 3 penghargaan KPK saat menjabat gubernur serta WTP 5x berturut-turut... #AminMiskinkanKoruptor https://t.co/yNymfkW1Jn","1747666356642996305","https://pbs.twimg.com/media/GED03cgbYAAuz0N.jpg","","in","","14","48","918","https://x.com/ekowboy2/status/1747666356642996305","1006827831995711488","ekowboy2"
"1747634886121316815","Wed Jan 17 15:00:00 +0000 2024","4960","Anies dapat tepuk tangan meriah saat jadi Rektor mewajibkan mata kuliah anti-korupsi untuk memutus mata rantai korupsi.. #AminMiskinkanKoruptor https://t.co/hgXsoQGaEa","1747634886121316815","https://pbs.twimg.com/ext_tw_video_thumb/1747627646786129923/pu/img/6Rh_OAhao8egLdPe.jpg","","in","","35","43","1397","https://x.com/ekowboy2/status/1747634886121316815","1006827831995711488","ekowboy2"
"1747626310715785244","Wed Jan 17 14:25:56 +0000 2024","787","Langkah berani Anies akan tuntaskan RUU perampasan aset &amp; RUU pembiayaan partai politik sebagai fokus utama.. #AminMiskinkanKoruptor https://t.co/YsvZhBSUge","1747626310715785244","https://pbs.twimg.com/ext_tw_video_thumb/1747620399087554560/pu/img/hqCA-gVUYMGbpGoU.jpg","","in","","7","8","275","https://x.com/ekowboy2/status/1747626310715785244","1006827831995711488","ekowboy2"
"1747613492029304880","Wed Jan 17 13:35:00 +0000 2024","3035","setuju banget!! videotron Jakarta &amp; Bekasi ditakedown se-indonesia raya jadi tau.. semesta berpihak ke pak Anies  https://t.co/pbfUTlKCkL","1747613492029304880","https://pbs.twimg.com/ext_tw_video_thumb/1747613275351822336/pu/img/x4dZE5aVp7xPloz_.jpg","","in","","4","29","830","https://x.com/ekowboy2/status/1747613492029304880","1006827831995711488","ekowboy2"
"1747602167375257933","Wed Jan 17 12:50:00 +0000 2024","4933","Anying keren bangettt nih capres.. https://t.co/tjBRrFUC10","1747602167375257933","https://pbs.twimg.com/ext_tw_video_thumb/1747581853119451136/pu/img/4a88rorOs7-6EVQ-.jpg","","in","","45","55","1197","https://x.com/ekowboy2/status/1747602167375257933","1006827831995711488","ekowboy2"
"1747589590498615690","Wed Jan 17 12:00:01 +0000 2024","424","JK: pemimpin yang emosional berbahaya sekali jika memimpin bangsa.. Anies Deserve Better https://t.co/bad1horlF2","1747589590498615690","https://pbs.twimg.com/ext_tw_video_thumb/1747572833981788160/pu/img/dsGW-PiVi5upghW_.jpg","","in","","2","6","124","https://x.com/ekowboy2/status/1747589590498615690","1006827831995711488","ekowboy2"
"1747580317408657603","Wed Jan 17 11:23:10 +0000 2024","5784","Anies apresiasi gerakan kreatif anak muda yang masif di TikTok Anies &amp; Cak Imin jadi icon yang menyatukan semua kalangan.. Anies Deserve Better https://t.co/GRptAhA4G8","1747580317408657603","https://pbs.twimg.com/ext_tw_video_thumb/1747575351675682817/pu/img/RqzO2N1L4V8MnTmg.jpg","","in","","16","59","1589","https://x.com/ekowboy2/status/1747580317408657603","1006827831995711488","ekowboy2"
"1747557823880519742","Wed Jan 17 09:53:47 +0000 2024","343","Menurut AHY food estate bertanggung jawab atas perubahan iklim &amp; proyek gagal.. Silahkan rakyat menilai!! https://t.co/sYWcW1Khmg","1747557823880519742","https://pbs.twimg.com/ext_tw_video_thumb/1747557124929159168/pu/img/bEwNj-puCfOPjnWL.jpg","","in","","11","31","185","https://x.com/ekowboy2/status/1747557823880519742","1006827831995711488","ekowboy2"
"1747539123085463963","Wed Jan 17 08:39:29 +0000 2024","6423","Banyak yang percaya jika Anies jadi Presiden masalah Papua akan selesai karena dia mau mendengar &amp; tidak berjarak dengan rakyat.. Setuju retweet  https://t.co/XDFKhJsPWU","1747539123085463963","https://pbs.twimg.com/ext_tw_video_thumb/1747538728070119424/pu/img/cktIta4hnerCGSzX.jpg","","in","","50","144","2689","https://x.com/ekowboy2/status/1747539123085463963","1006827831995711488","ekowboy2"
"1747507688517575060","Wed Jan 17 06:34:34 +0000 2024","8721","Ditakedown di Jakarta &amp; Bekasi videotron pak Anies muncul lagi di Surabaya Medan &amp; Gorontalo. Lawan intimidasi!! Anies Deserve Better Videotron #HotlineParisAMIN https://t.co/QHGCezLCk0","1747507688517575060","https://pbs.twimg.com/ext_tw_video_thumb/1747507636885700608/pu/img/-hGIjSf66O9fjPJT.jpg","","in","","321","180","3149","https://x.com/ekowboy2/status/1747507688517575060","1006827831995711488","ekowboy2"
"1747500202158866494","Wed Jan 17 06:04:49 +0000 2024","1678","Akses terhadap hukum sangat mahal &amp; berliku-liku bahkan seringkali kehilangan aset jika berurusan dg hukum rakyat akan sangat terbantu dg program bantuan hukum gratis yg digagas AMIN.. Anies Deserve Better Videotron #HotlineParisAMIN https://t.co/cHyXtotXDr","1747500202158866494","https://pbs.twimg.com/ext_tw_video_thumb/1747500007404777472/pu/img/D-v91F2whdSRmLiZ.jpg","","in","","13","22","633","https://x.com/ekowboy2/status/1747500202158866494","1006827831995711488","ekowboy2"
"1747422906387488947","Wed Jan 17 00:57:41 +0000 2024","4264","Mama Papua mengeluh ke Anies anaknya tidak sekolah karena SPP negeri bayar 200 ribu.. Itulah mengapa rakyat inginkan perubahan!! https://t.co/rD0w1tgLBD","1747422906387488947","https://pbs.twimg.com/ext_tw_video_thumb/1747422186690977792/pu/img/SDUEOYZ9bE9WE6B5.jpg","","in","","83","92","1734","https://x.com/ekowboy2/status/1747422906387488947","1006827831995711488","ekowboy2"
"1747247329307168865","Tue Jan 16 13:20:00 +0000 2024","3093","Ini versi kocaknya.. #PahitManiesAlwaysWithAnies https://t.co/YgIjBAODHQ","1747247329307168865","https://pbs.twimg.com/ext_tw_video_thumb/1747241771195904000/pu/img/CseyhDcaNS9oQIow.jpg","","in","","24","49","702","https://x.com/ekowboy2/status/1747247329307168865","1006827831995711488","ekowboy2"
"1747234809406210215","Tue Jan 16 12:30:15 +0000 2024","6767","Investigasi tim Metrotv di Graha Mandiri videotron tidak menyala &amp; tidak ada pihak yang bisa dimintai keterangan siapa dibalik penurunan videotron Anies.. APOLOGIZE TO ANIES #PahitManiesAlwaysWithAnies https://t.co/quSc6CHwko","1747234809406210215","https://pbs.twimg.com/ext_tw_video_thumb/1747229936677703681/pu/img/RiBO0GfHCoBDjuhY.jpg","","in","","82","338","2410","https://x.com/ekowboy2/status/1747234809406210215","1006827831995711488","ekowboy2"
"1747175742071611854","Tue Jan 16 08:35:32 +0000 2024","4279","Gasss terus.. #PahitManiesAlwaysWithAnies https://t.co/RedokIKizg","1747175742071611854","https://pbs.twimg.com/ext_tw_video_thumb/1747175703794298880/pu/img/j9yijdXdFg3MBYMm.jpg","","in","","32","52","1106","https://x.com/ekowboy2/status/1747175742071611854","1006827831995711488","ekowboy2"
"1747149182513893634","Tue Jan 16 06:50:00 +0000 2024","1107","Mengutip pernyataan Fahri Hamzah IKN tidak ada manfaatnya bagi rakyat uang negara dihamburkan saat rakyat sedang susah Anies Deserve Better #AniesTolakIKN https://t.co/JtIXFn4OHJ","1747149182513893634","https://pbs.twimg.com/ext_tw_video_thumb/1742004925159325696/pu/img/CtUr_XriLotHwWGg.jpg","","in","","69","99","589","https://x.com/ekowboy2/status/1747149182513893634","1006827831995711488","ekowboy2"
"1747135613567140350","Tue Jan 16 05:56:05 +0000 2024","1825","IKN hanya akan dinikmati segelintir birokrat bukan rakyat dimana logikanya membangun istana mewah atas nama pemerataan.. Anies Deserve Better #AMINTolakIKN https://t.co/mie4msDW78","1747135613567140350","https://pbs.twimg.com/ext_tw_video_thumb/1747134500927410176/pu/img/Moy_wZlx9adJYeHj.jpg","","in","","12","127","661","https://x.com/ekowboy2/status/1747135613567140350","1006827831995711488","ekowboy2"
"1747124356059447623","Tue Jan 16 05:11:21 +0000 2024","3985","Ekspresi Anies kagum &amp; salut dg soliditas serta kreativitas kpopers ini kan mahal.. Anies Deserve Better https://t.co/YcQSLNXydE","1747124356059447623","https://pbs.twimg.com/ext_tw_video_thumb/1747120883536474112/pu/img/12kXF58xa-tmadRS.jpg","","in","","18","129","1337","https://x.com/ekowboy2/status/1747124356059447623","1006827831995711488","ekowboy2"
"1747076208355905674","Tue Jan 16 02:00:01 +0000 2024","9526","Gemoy takut sama LED ads.. Anies Deserve Better Abah hwaiting!! https://t.co/l1kcnA4uhl","1747076208355905674","https://pbs.twimg.com/ext_tw_video_thumb/1747073369944821760/pu/img/uhkp-N8Jg2QoA1fg.jpg","","en","","250","265","2479","https://x.com/ekowboy2/status/1747076208355905674","1006827831995711488","ekowboy2"
"1747069166287475028","Tue Jan 16 01:32:02 +0000 2024","8598","Penurunan videotron ini damagenya akan besar karena yg direpresi anak muda yg sedang asyik berkreasi.. #PahitManiesAlwaysWithAnies https://t.co/NtswJpU24T","1747069166287475028","https://pbs.twimg.com/ext_tw_video_thumb/1747069074142818304/pu/img/QH99zbosnlNPZ3IY.jpg","","in","","83","288","3102","https://x.com/ekowboy2/status/1747069166287475028","1006827831995711488","ekowboy2"
"1747040918866416100","Mon Jan 15 23:39:48 +0000 2024","2528","anak Abah tidak akan mundur dg intimidasi apalagi komen Abah makin bikin haru &amp; bangga.. #PahitManiesAlwaysWithAnies https://t.co/9PrzzPE6Fk","1747040918866416100","https://pbs.twimg.com/media/GD68dOabYAAfx1Z.jpg","","in","","10","28","719","https://x.com/ekowboy2/status/1747040918866416100","1006827831995711488","ekowboy2"
"1747032812673515555","Mon Jan 15 23:07:35 +0000 2024","5239","ini hashtag videotron OLPPROJECT yang ditakedown.. yuk naikan gasss!! #PahitManiesAlwaysWithAnies #PahitManiesAlwaysWithAnies https://t.co/dOb3CmvoTt","1747032812673515555","https://pbs.twimg.com/media/GD61FaFbkAAmyRe.jpg","","in","","87","223","2277","https://x.com/ekowboy2/status/1747032812673515555","1006827831995711488","ekowboy2"
"1746898088281903194","Mon Jan 15 17:07:59 +0000 2024","164","@olpproject @aniesbaswedan @aniesbubble Siapa ngaruh bawang disini ","1746942315099476037","","olpproject","in","","0","4","2","https://x.com/ekowboy2/status/1746942315099476037","1006827831995711488","ekowboy2"
"1746934235917865338","Mon Jan 15 16:35:52 +0000 2024","21008","Anies balas insiden videotron kpopers yg ditakedown survei tembus 50% kok panik.. Silahkan rakyat menilai!! https://t.co/mibtD6eSYw","1746934235917865338","https://pbs.twimg.com/media/GD5bbfIaUAQWVca.jpg","","in","","174","217","4192","https://x.com/ekowboy2/status/1746934235917865338","1006827831995711488","ekowboy2"
"1746874882934411398","Mon Jan 15 12:40:02 +0000 2024","3187","Ambon luar biasa.. Anies-Muhaimin membawa harapan baru bukti rakyat tidak bisa dibeli dengan uang!! https://t.co/szwBlo2syj","1746874882934411398","https://pbs.twimg.com/ext_tw_video_thumb/1746873114112442368/pu/img/IUM-ciAocQfwdSsX.jpg","","in","","6","30","1015","https://x.com/ekowboy2/status/1746874882934411398","1006827831995711488","ekowboy2"
"1746844581222895861","Mon Jan 15 10:39:37 +0000 2024","12450","Yang ingin abah Anies terpilih jadi Presiden RI 2024 silahkan retweet!! https://t.co/oWI959i2VE","1746844581222895861","https://pbs.twimg.com/media/GD4J46MaoAAQ-4k.jpg","","in","","318","303","9334","https://x.com/ekowboy2/status/1746844581222895861","1006827831995711488","ekowboy2"
"1746776641903403338","Mon Jan 15 06:09:39 +0000 2024","369","Rumah murah &amp; terjangkau jadi isu central anak muda bahkan diangkat saat debat sudah dibuktikan Anies di Jakarta.. #RumahMurahAMIN https://t.co/HTWJq0Kr7p","1746776641903403338","https://pbs.twimg.com/ext_tw_video_thumb/1746773672491454464/pu/img/Fw40O75Q8tQwPDwN.jpg","","in","","2","15","153","https://x.com/ekowboy2/status/1746776641903403338","1006827831995711488","ekowboy2"
"1746747206571548999","Mon Jan 15 04:12:41 +0000 2024","5072","Cak Imin adalah cucu dari pendiri NU kena body shaming dari pendukung Prabowo kalah argumen nyerang fisik.. Silahkan rakyat menilai!! https://t.co/aPgrwJECcZ","1746747206571548999","https://pbs.twimg.com/media/GD2xUwwbgAAGhfh.jpg","","in","","586","349","1121","https://x.com/ekowboy2/status/1746747206571548999","1006827831995711488","ekowboy2"
"1746722420600524971","Mon Jan 15 02:34:12 +0000 2024","794","baju abah Anies bikin salfok.. #DesakAniesAmbon https://t.co/Gl9Xy1xZPv","1746722420600524971","https://pbs.twimg.com/ext_tw_video_thumb/1746722005230194688/pu/img/HQk0PFw0yGu1ZMSN.jpg","","in","","0","98","236","https://x.com/ekowboy2/status/1746722420600524971","1006827831995711488","ekowboy2"
"1746719573100179844","Mon Jan 15 02:22:53 +0000 2024","1274","Anies janji akan bikin lapangan sepak bola di kampung-kampung bersandar FIFA sindir ET rumputnya jgn diganti ya.. #DesakAniesAmbon https://t.co/4pz2tEbWBx","1746719573100179844","https://pbs.twimg.com/ext_tw_video_thumb/1746719159655034880/pu/img/kcqlAD32dy6cVfVS.jpg","","in","","5","25","424","https://x.com/ekowboy2/status/1746719573100179844","1006827831995711488","ekowboy2"
"1746702040380948670","Mon Jan 15 01:13:13 +0000 2024","1578","Anies bicara ketimpangan pendidikan Jawa - luar Jawa dg bangun perpus bersandar internasional merata mensubsidi biaya pengiriman buku &amp; perbanyak spot internet gratis.. Silahkan simak!! https://t.co/6P3DppbraK","1746702040380948670","https://pbs.twimg.com/ext_tw_video_thumb/1746700717895892992/pu/img/2WaG_FtbEaaLnUMR.jpg","","in","","9","20","509","https://x.com/ekowboy2/status/1746702040380948670","1006827831995711488","ekowboy2"
"1746519271390556669","Sun Jan 14 13:06:57 +0000 2024","5233","AMIN hanya punya doa Tidak punya PAMAN di MK.. https://t.co/jRAHNwGsc7","1746519271390556669","https://pbs.twimg.com/media/GDziBaMaQAAkhLZ.jpg","","in","","6","65","1350","https://x.com/ekowboy2/status/1746519271390556669","1006827831995711488","ekowboy2"
"1746416687107416383","Sun Jan 14 06:19:19 +0000 2024","396","#AMINBangunStadion #AMINBangunStadion #AMINBangunStadion https://t.co/GjgiFfpMho","1746416687107416383","https://pbs.twimg.com/ext_tw_video_thumb/1746416632833114112/pu/img/wHMQB912JRlIKAwk.jpg","","qme","","3","8","126","https://x.com/ekowboy2/status/1746416687107416383","1006827831995711488","ekowboy2"
"1746392735182196854","Sun Jan 14 04:44:09 +0000 2024","79","Program bagus nih.. jam satu ingat nomer satu Jadi setiap jam satu siang share program AMIN serentak di twitter Silahkan follow @FokusAminCom juga Gabung ke WA Group &amp; Tele Fokus AMIN biar bisa ikutan https://t.co/sisLBumWI6 https://t.co/125BRgU0tQ Bantu retweet!! https://t.co/eTDnLzVFRd","1746392735182196854","https://pbs.twimg.com/ext_tw_video_thumb/1746392532899229696/pu/img/uuqrOXEuIb8QnZnn.jpg","","in","","1","5","43","https://x.com/ekowboy2/status/1746392735182196854","1006827831995711488","ekowboy2"
"1746354302241865930","Sun Jan 14 02:11:26 +0000 2024","2484","Tidak ada kesepakatan koalisi 01 &amp; 03 yang ada kita mau tanding di putaran dua scr fair dg riang gembira.. Capek banget lawan capres yg punya gangguan mental!! https://t.co/BQidj1KXh2","1746354302241865930","https://pbs.twimg.com/media/GDxL-r5a8AAR_0L.jpg","","in","","12","50","458","https://x.com/ekowboy2/status/1746354302241865930","1006827831995711488","ekowboy2"
"1746340468701749413","Sun Jan 14 01:16:27 +0000 2024","2668","belajar ngetreat anak agar merasa dihargai dari Abah https://t.co/WsR8xbRK7O","1746340468701749413","https://pbs.twimg.com/ext_tw_video_thumb/1746340046310100992/pu/img/SSZpyopLsvcFJaiJ.jpg","","in","","5","22","654","https://x.com/ekowboy2/status/1746340468701749413","1006827831995711488","ekowboy2"
"1746310782936297776","Sat Jan 13 23:18:30 +0000 2024","601","Setelah provokasi pendukung lalu cuci tangan silahkan rakyat menilai!! https://t.co/VsN2GF3qP1","1746310782936297776","https://pbs.twimg.com/ext_tw_video_thumb/1746309901427875841/pu/img/EQaBQ74BWH6ftFx_.jpg","","in","","6","52","325","https://x.com/ekowboy2/status/1746310782936297776","1006827831995711488","ekowboy2"
"1746172939039658451","Sat Jan 13 14:10:45 +0000 2024","5844","luar biasa antusiasme Rakyat menyambut Anies ditengah hujan.. sehat selalu abah https://t.co/BxRlm4QoZt","1746172939039658451","https://pbs.twimg.com/ext_tw_video_thumb/1746172044923002880/pu/img/ZlD83yCQCqMy9Hzl.jpg","","in","","34","98","1775","https://x.com/ekowboy2/status/1746172939039658451","1006827831995711488","ekowboy2"
"1746148952641290678","Sat Jan 13 12:35:26 +0000 2024","637","Anies sindir ada yang gagal move on kalo debatnya berhasil pasti tenang gak jelekin lawan.. Gemoy kena sleding!! https://t.co/AIcapNrmgO","1746148952641290678","https://pbs.twimg.com/ext_tw_video_thumb/1746148912417964032/pu/img/yNg_8n3deTtQ5V8L.jpg","","in","","2","10","186","https://x.com/ekowboy2/status/1746148952641290678","1006827831995711488","ekowboy2"
"1746129201114362292","Sat Jan 13 11:16:57 +0000 2024","3282","NU bersatu menangkan Anies-Muhaimin lawan politik dinasti.. AMIN.. Ya Allah https://t.co/ExKsFhizQ4","1746129201114362292","https://pbs.twimg.com/media/GDt_QLDawAAMBaA.jpg","","in","","8","41","835","https://x.com/ekowboy2/status/1746129201114362292","1006827831995711488","ekowboy2"
"1746079173213577241","Sat Jan 13 07:58:10 +0000 2024","13777","Emosi paling stabil tidak anti kritik dekat dg rakyat serta kinerjanya memuaskan.. Pemimpin spek idaman setuju retweet!! https://t.co/eWTbCXpgDN","1746079173213577241","https://pbs.twimg.com/media/GDtRwVDbgAApugF.jpg","","in","","82","422","5851","https://x.com/ekowboy2/status/1746079173213577241","1006827831995711488","ekowboy2"
"1746053727155523992","Sat Jan 13 06:17:03 +0000 2024","1946","Tidak main-main Anies berencana memberantas judi online yang sebagian besar korbannya rakyat berpenghasilan kecil.. #AminBerantasJudol https://t.co/S5uUce6aLI","1746053727155523992","https://pbs.twimg.com/ext_tw_video_thumb/1746053238984757248/pu/img/CVGZY-c-MJELzgl_.jpg","","in","","5","46","716","https://x.com/ekowboy2/status/1746053727155523992","1006827831995711488","ekowboy2"
"1745983399683317978","Sat Jan 13 01:37:35 +0000 2024","4865","Anies senang kampanye interaksi langsung dg rakyat seperti DESAK ANIES &amp; Live TikTok ditiru paslon lain kampanye jadi berkualitas.. #AMINAjaDulu https://t.co/NL8uDLiiju","1745983399683317978","https://pbs.twimg.com/ext_tw_video_thumb/1745982042142367744/pu/img/ZHH6YgCbVx-TDT0q.jpg","","in","","29","59","1505","https://x.com/ekowboy2/status/1745983399683317978","1006827831995711488","ekowboy2"
"1745798994305900600","Fri Jan 12 13:24:50 +0000 2024","4701","Anies jelaskan BUMN salah arah tugas negara adalah pembangunan bukan cari untung.. Silahkan rakyat menilai!! https://t.co/Irtpbz8vpm","1745798994305900600","https://pbs.twimg.com/ext_tw_video_thumb/1745797041698279424/pu/img/Ql_-fmwPWg0j6an1.jpg","","in","","47","139","1591","https://x.com/ekowboy2/status/1745798994305900600","1006827831995711488","ekowboy2"
"1745772325956731269","Fri Jan 12 11:38:52 +0000 2024","468","ini capres gak ada obat.. https://t.co/ChRh5IWJmO","1745772325956731269","https://pbs.twimg.com/ext_tw_video_thumb/1745769934616223744/pu/img/OSGNplkP69Zob7X2.jpg","","in","","0","10","108","https://x.com/ekowboy2/status/1745772325956731269","1006827831995711488","ekowboy2"
"1745758562729783526","Fri Jan 12 10:44:10 +0000 2024","3718","Kesaksian jujur Fahri Hamzah Anies aktivis penggerak reformasi.. Kini demi kekuasaan dia khianati perjuangan kawan-kawannya sendiri!! https://t.co/6cVMRBGdDs","1745758562729783526","https://pbs.twimg.com/media/GDouKUlaEAA-RQs.jpg","","in","","173","137","1365","https://x.com/ekowboy2/status/1745758562729783526","1006827831995711488","ekowboy2"
"1745719799626481777","Fri Jan 12 08:10:08 +0000 2024","1330","Ini gagasan orisinal Anies &amp; terbukti mengurai kemacetan murah nyaman ramah lingkungan serta aman.. AMIN menang jadi kebijakan nasional!! #JakLingkoAnies https://t.co/mg86nuyw14","1745719799626481777","https://pbs.twimg.com/ext_tw_video_thumb/1745717370684133376/pu/img/x30vk4dWIEoHAPDq.jpg","","in","","4","9","515","https://x.com/ekowboy2/status/1745719799626481777","1006827831995711488","ekowboy2"
"1745430367220412568","Fri Jan 12 05:24:33 +0000 2024","174","Ini caption IG Nirina Zubir sebelum diedit yg dikutip media.. Dia menolak ajakan Raffi yg sudah dukung Prabowo emang malesin banget liat sikapnya kalo masalah tanah itu alasan aja lah https://t.co/L8Ht2pAcSv https://t.co/IBHz2yE5nn","1745678128880701708","https://pbs.twimg.com/media/GDnlAc9bkAAEoCC.jpg","ekowboy2","in","","0","7","20","https://x.com/ekowboy2/status/1745678128880701708","1006827831995711488","ekowboy2"
"1745430367220412568","Fri Jan 12 04:38:17 +0000 2024","228","Ini judul yang dikutip media dari IG Nirina Zubir sebelum diedit.. https://t.co/wTPQUlGSf9","1745666483190198707","https://pbs.twimg.com/media/GDnaal_aAAAgIQc.jpg","ekowboy2","in","","0","14","29","https://x.com/ekowboy2/status/1745666483190198707","1006827831995711488","ekowboy2"
"1745616583710613798","Fri Jan 12 01:20:00 +0000 2024","8494","Foto Anies &amp; @fadlizon saat masih jadi aktivis.. Sosok pemimpin yang matang punya rekam jejak tidak instan pake jalur MK!! https://t.co/liXiNOs8V4","1745616583710613798","https://pbs.twimg.com/media/GDmr3Z_bwAAtu9Q.jpg","","in","","80","256","1376","https://x.com/ekowboy2/status/1745616583710613798","1006827831995711488","ekowboy2"
"1745430367220412568","Thu Jan 11 13:00:02 +0000 2024","10356","Dengan background hitam Nirina Zubir nyatakan mundur dari menyuarakan Prabowo.. Banyak yang lelah lihat sikapnya!! https://t.co/vKP2vjrQPV","1745430367220412568","https://pbs.twimg.com/media/GDj7wCiaQAA_Guw.jpg","","in","","96","426","1456","https://x.com/ekowboy2/status/1745430367220412568","1006827831995711488","ekowboy2"
"1745414439929839720","Thu Jan 11 11:56:45 +0000 2024","2377","Bukan kaleng-kaleng AMIN siapkan perencanaan yg matang untuk bangun 40 kota di Indonesia Yang bilang Anies omon-omon silahkan simak!! https://t.co/8sZnsyxQ4A","1745414439929839720","https://pbs.twimg.com/ext_tw_video_thumb/1745412526899449856/pu/img/TnxsFOpUBuJyEd1B.jpg","","in","","10","31","879","https://x.com/ekowboy2/status/1745414439929839720","1006827831995711488","ekowboy2"
"1745358363830141158","Thu Jan 11 08:13:55 +0000 2024","2588","Anies sindir Prabowo saat debat tidak didesak selesai debat desak-desaknya rame.. Gemoy langsung kena ulti!! #DesakAniesSamarinda https://t.co/DGFggmr5IA","1745358363830141158","https://pbs.twimg.com/ext_tw_video_thumb/1745351843205750785/pu/img/VUTWXko-hB-vmjT1.jpg","","in","","139","27","705","https://x.com/ekowboy2/status/1745358363830141158","1006827831995711488","ekowboy2"
"1745349203080212847","Thu Jan 11 07:37:31 +0000 2024","2349","Supir di Samarinda mengeluhkan pembangunan jalan masih sangat lambat berharap jika Anies jadi Presiden jalan di Kalimantan setara dg jalan di Jawa.. #DesakAniesSamarinda https://t.co/qyzLS02Xbl","1745349203080212847","https://pbs.twimg.com/ext_tw_video_thumb/1745346593329684480/pu/img/nXTyLmZtBLPA1RZq.jpg","","in","","9","35","726","https://x.com/ekowboy2/status/1745349203080212847","1006827831995711488","ekowboy2"
"1745310049457799560","Thu Jan 11 05:01:56 +0000 2024","7079","Keren bangettt nih capres!!! https://t.co/z7AgIGw9Ff","1745310049457799560","https://pbs.twimg.com/ext_tw_video_thumb/1745304196906442752/pu/img/49P7xKl1SuTiXgRc.jpg","","in","","159","137","1552","https://x.com/ekowboy2/status/1745310049457799560","1006827831995711488","ekowboy2"
"1745285525815410992","Thu Jan 11 03:24:29 +0000 2024","4307","Nomernya satu  Presidennya Anies Wakilnya Cak Imin Partainya Nasdem PKB PKS Umat Retweet keras!! #DesakAniesSamarinda https://t.co/YnAAWfHeuW","1745285525815410992","https://pbs.twimg.com/ext_tw_video_thumb/1745285024382173184/pu/img/hU4ScmaeE99EIy0A.jpg","","in","","21","80","1962","https://x.com/ekowboy2/status/1745285525815410992","1006827831995711488","ekowboy2"
"1745247223909384340","Thu Jan 11 00:52:17 +0000 2024","4688","JK tantang Prabowo kembalikan tanah negara saya dengar lahannya tidak dipakai.. Silahkan rakyat menilai!! https://t.co/ns31RRAifo","1745247223909384340","https://pbs.twimg.com/ext_tw_video_thumb/1745089739231723520/pu/img/fH1Z6LnE0pggQQ93.jpg","","in","","156","81","1510","https://x.com/ekowboy2/status/1745247223909384340","1006827831995711488","ekowboy2"
"1745003429263823222","Wed Jan 10 08:43:32 +0000 2024","3250","Pelanggar HAM &amp; politik dinasti alasan kuat tidak memilih Gemoysian.. Setuju retweet!! https://t.co/0g5ggVuYt5","1745003429263823222","https://pbs.twimg.com/media/GDd_XbJa8AAd5e9.jpg","","in","","5","45","1231","https://x.com/ekowboy2/status/1745003429263823222","1006827831995711488","ekowboy2"
