"conversation_id_str","created_at","favorite_count","full_text","id_str","image_url","in_reply_to_screen_name","lang","location","quote_count","reply_count","retweet_count","tweet_url","user_id_str","username"
"1893476780758995448","Sun Feb 23 01:43:38 +0000 2025","7","Kepsek Ungkap Alasan Pecat Vokalis Sukatani Cara Ngajar Novi Twister Angel saat Jadi Guru Terkuak https://t.co/xXA1Ek0AoI","1893476780758995448","","","in","Indonesia","0","0","0","https://x.com/geloraco/status/1893476780758995448","3319260420","geloraco"
"1893475510308504006","Sun Feb 23 01:38:35 +0000 2025","6","Pernyataan Band Sukatani Usai Tarik Lagu Bayar Bayar Bayar Kabarkan Kondisi Membaik di Ruang Aman https://t.co/4KWJ262Nm9","1893475510308504006","","","in","Indonesia","0","0","2","https://x.com/geloraco/status/1893475510308504006","3319260420","geloraco"
"1893473993652375572","Sun Feb 23 01:32:33 +0000 2025","8","Antara Harapan dan Kekecewaan Menuju Indonesia Emas 2045 https://t.co/baR3nROvGI","1893473993652375572","","","in","Indonesia","0","2","1","https://x.com/geloraco/status/1893473993652375572","3319260420","geloraco"
"1893473387131088989","Sun Feb 23 01:30:09 +0000 2025","384","Megawati Diminta Pimpin Kader Banteng Geruduk KPK https://t.co/41JAKXNoRI","1893473387131088989","","","in","Indonesia","8","29","153","https://x.com/geloraco/status/1893473387131088989","3319260420","geloraco"
"1893472625822724107","Sun Feb 23 01:27:07 +0000 2025","3","Pengamat: Pernyataan Zulfadhli Tuduhan Serius terhadap Gerindra https://t.co/FJzs30vUoF","1893472625822724107","","","in","Indonesia","0","0","0","https://x.com/geloraco/status/1893472625822724107","3319260420","geloraco"
"1893471812878508526","Sun Feb 23 01:23:53 +0000 2025","2","Kepala Daerah Tidak Ikut Retret: Petugas Partai atau Petugas Rakyat Jangan Ada Negara Dalam Negara https://t.co/lyGssJh2K2","1893471812878508526","","","in","Indonesia","0","2","0","https://x.com/geloraco/status/1893471812878508526","3319260420","geloraco"
"1893471092397818140","Sun Feb 23 01:21:02 +0000 2025","957","KPK Harus Proses Kasus Dugaan Korupsi Jokowi dan Keluarga Jangan Dipetieskan https://t.co/NhejsNqXrG","1893471092397818140","","","in","Indonesia","13","64","411","https://x.com/geloraco/status/1893471092397818140","3319260420","geloraco"
"1893283693214441646","Sat Feb 22 12:56:22 +0000 2025","113","Viral Hotman Paris Diduga Kena Santet Saat Sidang Kasus Razman Netizen: Pesulap Merah Gimana Nie? https://t.co/w3oW2xQKwR","1893283693214441646","","","in","Indonesia","3","44","35","https://x.com/geloraco/status/1893283693214441646","3319260420","geloraco"
"1893282433266491610","Sat Feb 22 12:51:22 +0000 2025","2355","Blunder Rudi Valinka Stafsus Menkomdigi Diduga Sebar UU Palsu Pasrah Ketahuan Hoax? https://t.co/3GD53SyKQx","1893282433266491610","","","in","Indonesia","44","187","1174","https://x.com/geloraco/status/1893282433266491610","3319260420","geloraco"
"1893280348118884724","Sat Feb 22 12:43:05 +0000 2025","1","Jenderal IRGC: Israel akan Dilenyapkan Lewat Serangan Besar 'pada Saat yang Tepat' https://t.co/OfgcLvSvd0","1893280348118884724","","","in","Indonesia","0","0","1","https://x.com/geloraco/status/1893280348118884724","3319260420","geloraco"
"1893279362545262734","Sat Feb 22 12:39:10 +0000 2025","16","Viral! Video Diduga Danki Berpangkat Kapten Stres Berat Akibat Judol https://t.co/YTuiN5Ek62","1893279362545262734","","","in","Indonesia","2","3","8","https://x.com/geloraco/status/1893279362545262734","3319260420","geloraco"
"1893270652494176389","Sat Feb 22 12:04:33 +0000 2025","2","Detik-detik Adik Bunuh Kakak Kandung Pakai Pedang di Sukabumi Diduga Dipicu Perebutan Harta Warisan https://t.co/67OOIId76x","1893270652494176389","","","in","Indonesia","0","0","3","https://x.com/geloraco/status/1893270652494176389","3319260420","geloraco"
"1893269616438198545","Sat Feb 22 12:00:26 +0000 2025","1","Kepala Daerah PDIP Kumpul di Magelang Siaga Ikuti Retret Koper Sudah Siap di Area Akmil https://t.co/zs2MUsrMbr","1893269616438198545","","","in","Indonesia","0","0","0","https://x.com/geloraco/status/1893269616438198545","3319260420","geloraco"
"1893249379588296751","Sat Feb 22 10:40:01 +0000 2025","7","39 Rumah Hangus Terbakar di Asrama Kesdam Hasanuddin Makassar Kebakaran Diduga Dipicu Gas Bocor https://t.co/FGypiZa14j","1893249379588296751","","","in","Indonesia","0","0","1","https://x.com/geloraco/status/1893249379588296751","3319260420","geloraco"
"1893228739665801602","Sat Feb 22 09:18:00 +0000 2025","59","Rocky Gerung Anggap Jokowi Kompori Kader PDIP Tolak Perintah Megawati: Dia Ingin Memecah Belah https://t.co/WXL2BW3Zor","1893228739665801602","","","in","Indonesia","3","4","23","https://x.com/geloraco/status/1893228739665801602","3319260420","geloraco"
"1893227591248589172","Sat Feb 22 09:13:26 +0000 2025","70","Nyaris Perang! Kisah Mencekam Bentrok Kopassus vs Marinir di Jakarta https://t.co/hzpET13x5P","1893227591248589172","","","in","Indonesia","0","12","30","https://x.com/geloraco/status/1893227591248589172","3319260420","geloraco"
"1893221046406222323","Sat Feb 22 08:47:26 +0000 2025","37","Eks TNI AL Berondong Tembakan ke Mobil Polisi saat akan Ditangkap Terkait Kasus Narkoba https://t.co/8mOmzY0mNJ","1893221046406222323","","","in","Indonesia","2","3","19","https://x.com/geloraco/status/1893221046406222323","3319260420","geloraco"
"1893219432085758343","Sat Feb 22 08:41:01 +0000 2025","70","'Boikot' Retret Megawati Dianggap Mengajari Kader Melawan Konstitusi https://t.co/yxGi2ic4xA","1893219432085758343","","","in","Indonesia","11","91","24","https://x.com/geloraco/status/1893219432085758343","3319260420","geloraco"
"1893217159649583273","Sat Feb 22 08:31:59 +0000 2025","42","Ngeles! Polda Jateng Sebut Cuma Minta Klarifikasi Dari Band Sukatani Bukan Intimidasi https://t.co/0PWAy3DzJl","1893217159649583273","","","in","Indonesia","1","2","23","https://x.com/geloraco/status/1893217159649583273","3319260420","geloraco"
"1893216684036534307","Sat Feb 22 08:30:06 +0000 2025","2","Soal Vokalis Band Sukatani Dipecat sebagai Guru Ini Kata Ombudsman RI https://t.co/kNzNGP4Rlh","1893216684036534307","","","in","Indonesia","0","0","6","https://x.com/geloraco/status/1893216684036534307","3319260420","geloraco"
"1893215883998163202","Sat Feb 22 08:26:55 +0000 2025","16","Mendagri soal Retreat di Magelang: yang Nggak Ambil Bagian Rugi Sendiri https://t.co/3othIJi7cM","1893215883998163202","","","in","Indonesia","6","22","7","https://x.com/geloraco/status/1893215883998163202","3319260420","geloraco"
"1893215028872085524","Sat Feb 22 08:23:31 +0000 2025","10","Adian Napitupulu hingga Ahmad Basarah Merapat ke Rumah Megawati https://t.co/hla3hyoJd9","1893215028872085524","","","in","Indonesia","1","1","1","https://x.com/geloraco/status/1893215028872085524","3319260420","geloraco"
"1893212373634167263","Sat Feb 22 08:12:58 +0000 2025","1","Hasil Interogasi Propam Polda: Penyidik Periksa Band Sukatani Sudah Sesuai Tupoksi https://t.co/5jmKPwMFXt","1893212373634167263","","","in","Indonesia","0","1","0","https://x.com/geloraco/status/1893212373634167263","3319260420","geloraco"
"1893192737564041514","Sat Feb 22 06:54:57 +0000 2025","45","Natalius Pigai Bereaksi soal Kabar Vokalis Band Sukatani Dipecat dari Guru: Laporkan ke Kami https://t.co/sBAyQhI1zO","1893192737564041514","","","in","Indonesia","10","45","11","https://x.com/geloraco/status/1893192737564041514","3319260420","geloraco"
"1893190651312791849","Sat Feb 22 06:46:39 +0000 2025","9","Pramono Anung Tiba-tiba 'Membisu' Tak Ingin Komentari Retret di Magelang https://t.co/waRuJisLJK","1893190651312791849","","","in","Indonesia","1","2","2","https://x.com/geloraco/status/1893190651312791849","3319260420","geloraco"
"1893189186829926714","Sat Feb 22 06:40:50 +0000 2025","1","Respons Firdaus Oiwobo setelah Mendengar Hotman Paris Mendadak Sakit saat Sidang https://t.co/0yJHZFTzbU","1893189186829926714","","","in","Indonesia","0","0","1","https://x.com/geloraco/status/1893189186829926714","3319260420","geloraco"
"1893187881398661262","Sat Feb 22 06:35:39 +0000 2025","0","Pakar: Retret Kepala Daerah Punya Legal Basis yang Kokoh https://t.co/GSEwHmVaF5","1893187881398661262","","","in","Indonesia","0","1","0","https://x.com/geloraco/status/1893187881398661262","3319260420","geloraco"
"1893163908179075198","Sat Feb 22 05:00:23 +0000 2025","0","Viral Warga Jarah Kasur di TKP Kecelakaan Tol Cipularang Netizen: This is Indonesia! https://t.co/tcZZzCJx7r","1893163908179075198","","","in","Indonesia","0","0","0","https://x.com/geloraco/status/1893163908179075198","3319260420","geloraco"
"1893162798643061149","Sat Feb 22 04:55:59 +0000 2025","309","Mahfud MD: Grup Band Sukatani Tak Perlu Minta Maaf dan Tarik Lagu Mencipta Untuk Kritik Adalah HAM https://t.co/0hweizQJCe","1893162798643061149","","","in","Indonesia","2","11","122","https://x.com/geloraco/status/1893162798643061149","3319260420","geloraco"
"1893161542792946019","Sat Feb 22 04:50:59 +0000 2025","8","Band Sukatani Minta Maaf ke Polri Usai Nyanyikan 'Bayar Bayar Bayar' DKJ: Sensor Harus Dihentikan https://t.co/iwvg7NWmJv","1893161542792946019","","","in","Indonesia","1","3","0","https://x.com/geloraco/status/1893161542792946019","3319260420","geloraco"
"1893160092079661300","Sat Feb 22 04:45:13 +0000 2025","555","Bunga Utang Tinggi Kereta Cepat Jakarta-Bandung Langgar Konstitusi https://t.co/hb8heyQuL4","1893160092079661300","","","in","Indonesia","8","26","280","https://x.com/geloraco/status/1893160092079661300","3319260420","geloraco"
"1893148909264052482","Sat Feb 22 04:00:47 +0000 2025","23","Akhirnya Jokowi Ungkap Alasan Ogah Datang ke Sertijab Gubernur DKI Jakarta Pramono dan Rano https://t.co/B1iYb0yEn8","1893148909264052482","","","in","Indonesia","7","49","4","https://x.com/geloraco/status/1893148909264052482","3319260420","geloraco"
"1893147506541728138","Sat Feb 22 03:55:13 +0000 2025","1","Paramitha Widya Kusuma Bupati Brebes dari PDIP Ngeyel Ikut Retret Kepala Daerah https://t.co/tTjtibXaZm","1893147506541728138","","","in","Indonesia","1","3","1","https://x.com/geloraco/status/1893147506541728138","3319260420","geloraco"
"1893146259172532241","Sat Feb 22 03:50:15 +0000 2025","54","Nasib Remaja Curi Pisang Rp 250 Ribu di Pati Kini Diangkat Anak Asuh Polsek Tlogowungu https://t.co/vSciR3tXmm","1893146259172532241","","","in","Indonesia","0","2","15","https://x.com/geloraco/status/1893146259172532241","3319260420","geloraco"
"1893144869931286961","Sat Feb 22 03:44:44 +0000 2025","10","Mantan Wakil Rektor UBK: Larangan Retret Sinyal Ada Negara Partai di Dalam NKRI https://t.co/VTIhpZ240p","1893144869931286961","","","in","Indonesia","1","13","4","https://x.com/geloraco/status/1893144869931286961","3319260420","geloraco"
"1893144057955918111","Sat Feb 22 03:41:30 +0000 2025","6","Propam Periksa Anggota Ditsiber Polda Jateng Terkait Permintaan Maaf Personel Sukatani Band https://t.co/ZM8xk09QK9","1893144057955918111","","","in","Indonesia","0","0","0","https://x.com/geloraco/status/1893144057955918111","3319260420","geloraco"
"1893142464334307631","Sat Feb 22 03:35:11 +0000 2025","6","Status Megawati Sebagai Ketua Dewan Pengarah BRIN dan BPIP Digugat https://t.co/JNldl7XnsL","1893142464334307631","","","in","Indonesia","0","2","3","https://x.com/geloraco/status/1893142464334307631","3319260420","geloraco"
"1893131073338679549","Sat Feb 22 02:49:55 +0000 2025","5","Bupati Grobogan Setyo Hadi Tetap Berangkat Retret meski Megawati Instruksikan Penundaan https://t.co/YKoK8l8vbB","1893131073338679549","","","in","Indonesia","2","1","5","https://x.com/geloraco/status/1893131073338679549","3319260420","geloraco"
"1893129834148278323","Sat Feb 22 02:44:59 +0000 2025","51","Sosok Feni Ere Sales Mobil Setahun Hilang Jasadnya Tinggal Kerangka dengan Mulut Terikat di Palopo https://t.co/fyLowlq9uh","1893129834148278323","","","in","Indonesia","0","5","32","https://x.com/geloraco/status/1893129834148278323","3319260420","geloraco"
"1893128488091013485","Sat Feb 22 02:39:38 +0000 2025","1","Profil Vinanda Prameswati Wali Kota Termuda yang Curi Perhatian saat Retret di Magelang https://t.co/TIsEsVFesw","1893128488091013485","","","in","Indonesia","0","1","0","https://x.com/geloraco/status/1893128488091013485","3319260420","geloraco"
"1893113600287613162","Sat Feb 22 01:40:29 +0000 2025","1","Kecelakaan Beruntun 2 Truk dan Minibus di Tol Cipularang 4 Orang Terluka https://t.co/G6EOlgb1oC","1893113600287613162","","","in","Indonesia","0","0","0","https://x.com/geloraco/status/1893113600287613162","3319260420","geloraco"
"1893111451881218071","Sat Feb 22 01:31:57 +0000 2025","3","Tanggapan Jokowi dan Parpol soal Megawati Minta Kepala Daerah dari PDIP Tunda Ikuti Retret Magelang https://t.co/9iPDnFz7dk","1893111451881218071","","","in","Indonesia","0","0","0","https://x.com/geloraco/status/1893111451881218071","3319260420","geloraco"
"1893102229575606438","Sat Feb 22 00:55:18 +0000 2025","0","Dukung Kemkomdigi Buat Aturan Anak di Ruang Digital TikTok Sudah Siapkan Fitur Baru Apa Itu? https://t.co/MhcrTp2luq","1893102229575606438","","","in","Indonesia","0","0","0","https://x.com/geloraco/status/1893102229575606438","3319260420","geloraco"
"1893101046806827363","Sat Feb 22 00:50:36 +0000 2025","10","Heboh Video Syur Wanita Jilbab Merah Joget-joget Tanpa Sehelai Benang Diduga Seorang Guru SD di Jember... https://t.co/wwNLnZCEJ6","1893101046806827363","","","in","Indonesia","0","1","2","https://x.com/geloraco/status/1893101046806827363","3319260420","geloraco"
"1893100182360990195","Sat Feb 22 00:47:10 +0000 2025","24","Terancam Hukuman 20 Tahun Penjara Nikita Mirzani Sewot: Masa Lebih Parah dari Suami Sandra Dewi https://t.co/8qsukgBED4","1893100182360990195","","","in","Indonesia","3","1","3","https://x.com/geloraco/status/1893100182360990195","3319260420","geloraco"
"1893090805465874598","Sat Feb 22 00:09:54 +0000 2025","0","Sempat Tak Penuhi Panggilan Bareskrim Polri Sebut Razman Arif Nasution Terjadwal Pemeriksaan Buntut Kisruh di Sidang PN Jakarta Utara https://t.co/tIwZjIeAxw","1893090805465874598","","","in","Indonesia","0","0","0","https://x.com/geloraco/status/1893090805465874598","3319260420","geloraco"
"1893089689025888374","Sat Feb 22 00:05:28 +0000 2025","4","Nekat Study Tour Kepsek di Jabar Langsung Dinonaktifkan https://t.co/eYM2PgulHG","1893089689025888374","","","in","Indonesia","0","1","2","https://x.com/geloraco/status/1893089689025888374","3319260420","geloraco"
"1893088939881201739","Sat Feb 22 00:02:29 +0000 2025","75","Jejak Digital Raja Juli Antoni Dibongkar Usai Sindir Instruksi Megawati https://t.co/zk8Q6RqlPR","1893088939881201739","","","in","Indonesia","2","7","43","https://x.com/geloraco/status/1893088939881201739","3319260420","geloraco"
"1893088727695794367","Sat Feb 22 00:01:39 +0000 2025","4","MUI Geram Beredar Video Syur Berdurasi 22 Detik dengan Pemeran Wanita Bercadar: Menistakan Agama Itu! https://t.co/3VAraK2PhB","1893088727695794367","","","in","Indonesia","0","2","0","https://x.com/geloraco/status/1893088727695794367","3319260420","geloraco"
"1893088332294562009","Sat Feb 22 00:00:04 +0000 2025","86","PDIP sebut Jokowi Tak Berhak Komentari Instruksi Megawati https://t.co/HGeMuSurgT","1893088332294562009","","","in","Indonesia","8","23","28","https://x.com/geloraco/status/1893088332294562009","3319260420","geloraco"
"1893087779111989494","Fri Feb 21 23:57:53 +0000 2025","83","Divisi Propam Periksa 4 Polisi Buntut Lagu 'Bayar Bayar Bayar' https://t.co/O1Q47CaV9W","1893087779111989494","","","in","Indonesia","1","13","28","https://x.com/geloraco/status/1893087779111989494","3319260420","geloraco"
"1893087339645411530","Fri Feb 21 23:56:08 +0000 2025","73","Megawati Kecewa Berat terhadap Kondisi Hukum Indonesia https://t.co/ywqdKdyvmX https://t.co/I7VxefyMyD","1893087339645411530","https://pbs.twimg.com/media/GkWY5yebQAAsypX.jpg","","in","Indonesia","16","83","23","https://x.com/geloraco/status/1893087339645411530","3319260420","geloraco"
"1892997864336273488","Fri Feb 21 18:00:35 +0000 2025","23434","Kaesang Dikabarkan Bakal Duduki Posisi Strategis Danantara Jokowi Family Makin Menyala https://t.co/jaR7wfthAc","1892997864336273488","","","in","Indonesia","4177","2721","5307","https://x.com/geloraco/status/1892997864336273488","3319260420","geloraco"
"1892996651272569223","Fri Feb 21 17:55:46 +0000 2025","30","Luhut Usul ke Prabowo BBM Subsidi Dihapus pada 2027 Harganya Jadi Segini https://t.co/NUsgge1rou","1892996651272569223","","","in","Indonesia","8","98","11","https://x.com/geloraco/status/1892996651272569223","3319260420","geloraco"
"1892989512126734556","Fri Feb 21 17:27:24 +0000 2025","45","Demo Indonesia Gelap di Makassar Mahasiswa-Warga Bentrok Saling Lempar Panah https://t.co/gJm0cg5UHf","1892989512126734556","","","in","Indonesia","2","5","14","https://x.com/geloraco/status/1892989512126734556","3319260420","geloraco"
"1892972186626916671","Fri Feb 21 16:18:33 +0000 2025","205","Bayar Rp850 Juta agar Lulus Jadi Perwira Ternyata Gagal Polisi Kena Tipu Sesama Polisi https://t.co/a8BZXRMJC5","1892972186626916671","","","in","Indonesia","18","40","100","https://x.com/geloraco/status/1892972186626916671","3319260420","geloraco"
"1892963774719529368","Fri Feb 21 15:45:08 +0000 2025","7","Syahganda: Bu Mega Harus Lebih Bijaksana Dalam Berpolitik https://t.co/WNn4D8jQQN","1892963774719529368","","","in","Indonesia","1","9","1","https://x.com/geloraco/status/1892963774719529368","3319260420","geloraco"
"1892963634688745791","Fri Feb 21 15:44:34 +0000 2025","12","Belajar Dari Kasus Hasto APH Harus Usut Skandal E-KTP Ganjar https://t.co/JCdBf0SjNe","1892963634688745791","","","in","Indonesia","1","1","3","https://x.com/geloraco/status/1892963634688745791","3319260420","geloraco"
"1892962252816580881","Fri Feb 21 15:39:05 +0000 2025","16","Pekan Depan Bareskrim Panggil Kades Kohod Cs https://t.co/ixOJbenbiE","1892962252816580881","","","in","Indonesia","0","0","1","https://x.com/geloraco/status/1892962252816580881","3319260420","geloraco"
"1892961141510619312","Fri Feb 21 15:34:40 +0000 2025","11","Kasus Hasto Murni Hukum Bukan Politisasi Jangan Senggol Prabowo! https://t.co/OIL4QsTT5P","1892961141510619312","","","in","Indonesia","2","0","2","https://x.com/geloraco/status/1892961141510619312","3319260420","geloraco"
"1892960197011779748","Fri Feb 21 15:30:55 +0000 2025","4","Instruksi Megawati jadi Simalakama Kader PDIP yang Menjabat Kepala Daerah https://t.co/2tBzJZXuck","1892960197011779748","","","in","Indonesia","1","1","0","https://x.com/geloraco/status/1892960197011779748","3319260420","geloraco"
"1892957326698528959","Fri Feb 21 15:19:30 +0000 2025","57","Aksi TNI Tertibkan Tambang Emas dan Gerebek Oli Palsu Langgar UU https://t.co/MqUG4GZ0TV","1892957326698528959","","","in","Indonesia","3","13","18","https://x.com/geloraco/status/1892957326698528959","3319260420","geloraco"
"1892956187651666338","Fri Feb 21 15:14:59 +0000 2025","10","Perkara Sugar Group Hilang di Dakwaan Zarof Jampidsus Harus Dievaluasi https://t.co/Pn0TnpAt2M","1892956187651666338","","","in","Indonesia","0","0","4","https://x.com/geloraco/status/1892956187651666338","3319260420","geloraco"
"1892945005582733367","Fri Feb 21 14:30:33 +0000 2025","1","Terungkap Permintaan Terakhir Cinta Novita ke Ibunya Tak Bisa Terpenuhi karena Tak Ada Uang https://t.co/fJ7i1jQpI6","1892945005582733367","","","in","Indonesia","0","0","0","https://x.com/geloraco/status/1892945005582733367","3319260420","geloraco"
"1892943242301526314","Fri Feb 21 14:23:32 +0000 2025","2","Penyanyi Lagu Minang Remon Ditangkap! Tipu Peras dan Lecehkan Wanita https://t.co/ZmXpqc4l0b","1892943242301526314","","","in","Indonesia","0","0","0","https://x.com/geloraco/status/1892943242301526314","3319260420","geloraco"
"1892940586551853141","Fri Feb 21 14:12:59 +0000 2025","22","Div Propam Periksa Anggota Siber Polda Jateng soal Permasalahan Lagu Band Sukatani https://t.co/4kUvb1kVyd","1892940586551853141","","","in","Indonesia","0","2","5","https://x.com/geloraco/status/1892940586551853141","3319260420","geloraco"
"1892936827545264226","Fri Feb 21 13:58:03 +0000 2025","361","Jakarta Memanas Massa Aksi #IndonesiaGelap Bakar Kaos Prabowo-Gibran! https://t.co/VIeUm8OW9O","1892936827545264226","","","in","Indonesia","4","9","127","https://x.com/geloraco/status/1892936827545264226","3319260420","geloraco"
"1892935485951291510","Fri Feb 21 13:52:43 +0000 2025","83","Aksi di Patung Kuda Mulai Memanas: Massa Mulai Provokasi dan Lempari Polisi https://t.co/yUqyY1sQ7t","1892935485951291510","","","in","Indonesia","2","3","30","https://x.com/geloraco/status/1892935485951291510","3319260420","geloraco"
"1892931149787251051","Fri Feb 21 13:35:29 +0000 2025","92","Gubernur Pramono Anung Menghilang PDIP pun tak Tahu Keberadaannya https://t.co/4hlZrCbRuw","1892931149787251051","","","in","Indonesia","3","15","27","https://x.com/geloraco/status/1892931149787251051","3319260420","geloraco"
"1892930171700924452","Fri Feb 21 13:31:36 +0000 2025","12","Tim Hukum Merah Putih Tuding Megawati Seperti Ingin Acak-acak Program Presiden Prabowo https://t.co/H7nU4xY4Ya","1892930171700924452","","","in","Indonesia","2","12","2","https://x.com/geloraco/status/1892930171700924452","3319260420","geloraco"
"1892921115057774826","Fri Feb 21 12:55:37 +0000 2025","0","PDIP Boikot Retret di Magelang Kepala Daerah Berpeluang Pindah Partai https://t.co/iZ3E43ILcE","1892921115057774826","","","in","Indonesia","0","0","0","https://x.com/geloraco/status/1892921115057774826","3319260420","geloraco"
"1892919733621780505","Fri Feb 21 12:50:07 +0000 2025","177","Gerindra Bela Polisi di Kasus Lagu Sukatani 'Bayar Bayar Bayar' Fadli Zon: Kebebasan Ada Batasnya https://t.co/P6o2wbqjWv","1892919733621780505","","","in","Indonesia","35","272","52","https://x.com/geloraco/status/1892919733621780505","3319260420","geloraco"
"1892918742700711970","Fri Feb 21 12:46:11 +0000 2025","5475","KPK Ngeles Soal Periksa Keluarga Jokowi https://t.co/570UryiIeJ","1892918742700711970","","","in","Indonesia","119","478","1770","https://x.com/geloraco/status/1892918742700711970","3319260420","geloraco"
"1892916794438152663","Fri Feb 21 12:38:27 +0000 2025","7","Jokowi Disuruh PDIP Tutup Mulut Usai Ingatkan Megawati Jangan Ganggu Program Prabowo https://t.co/wOTqmdSFWx","1892916794438152663","","","in","Indonesia","0","3","0","https://x.com/geloraco/status/1892916794438152663","3319260420","geloraco"
"1892916100083380729","Fri Feb 21 12:35:41 +0000 2025","1","Polisi Temukan Bukti Baru Pembunuhan Cinta Novita Orang yang Menjemputnya Terekam CCTV https://t.co/hwbUN6LScj","1892916100083380729","","","in","Indonesia","0","1","2","https://x.com/geloraco/status/1892916100083380729","3319260420","geloraco"
"1892898702445949168","Fri Feb 21 11:26:33 +0000 2025","7","LSAK: KPK Sudah Independen Jebloskan Hasto ke Tahanan https://t.co/7C9FOtu52Y","1892898702445949168","","","in","Indonesia","0","0","1","https://x.com/geloraco/status/1892898702445949168","3319260420","geloraco"
"1892897929230451007","Fri Feb 21 11:23:29 +0000 2025","29","47 Kepala Daerah Tidak Ada Kabar Kehadiran di Retret Diduga dari PDIP https://t.co/POj3jvYo5U","1892897929230451007","","","in","Indonesia","3","10","4","https://x.com/geloraco/status/1892897929230451007","3319260420","geloraco"
"1892896890758348925","Fri Feb 21 11:19:21 +0000 2025","5","Wanted Jokowi https://t.co/Sd1yVGR6Sh","1892896890758348925","","","en","Indonesia","0","0","1","https://x.com/geloraco/status/1892896890758348925","3319260420","geloraco"
"1892896106104967325","Fri Feb 21 11:16:14 +0000 2025","2","Kepala Daerah Terpilih PDIP Sudah Petugas Rakyat Harusnya Ikut Retret https://t.co/oN8uXFIXj2","1892896106104967325","","","in","Indonesia","1","6","0","https://x.com/geloraco/status/1892896106104967325","3319260420","geloraco"
"1892894800736825801","Fri Feb 21 11:11:03 +0000 2025","9","Vonis Budi Said Diperberat jadi 16 Tahun Penjara Uang Pengganti Rp1 1 Triliun https://t.co/UNRey1kCXa","1892894800736825801","","","in","Indonesia","0","0","3","https://x.com/geloraco/status/1892894800736825801","3319260420","geloraco"
"1892893375004659795","Fri Feb 21 11:05:23 +0000 2025","14","Hasto Akhirnya Ditahan Komik: Tidak Ada yang Kebal Hukum Meski Punya Posisi Penting https://t.co/yhnVeeEVsD","1892893375004659795","","","in","Indonesia","1","5","4","https://x.com/geloraco/status/1892893375004659795","3319260420","geloraco"
"1892892402492305875","Fri Feb 21 11:01:31 +0000 2025","3","Kapolri soal Personel Sukatani Band: Tidak Masalah Mungkin Ada Mis https://t.co/1DpZthdMpC","1892892402492305875","","","in","Indonesia","0","2","1","https://x.com/geloraco/status/1892892402492305875","3319260420","geloraco"
"1892891633550840083","Fri Feb 21 10:58:28 +0000 2025","2","Seluruh Kepala Daerah dari Golkar Dipastikan Ikut Retret https://t.co/D8G6m5NGhr","1892891633550840083","","","in","Indonesia","0","1","0","https://x.com/geloraco/status/1892891633550840083","3319260420","geloraco"
"1892889722684620910","Fri Feb 21 10:50:52 +0000 2025","21","Hari Pertama Kerja Rano Karno Bertekad Benahi Masalah Banjir Jakarta https://t.co/iosIpk5uPt","1892889722684620910","","","in","Indonesia","0","5","4","https://x.com/geloraco/status/1892889722684620910","3319260420","geloraco"
"1892875714711470577","Fri Feb 21 09:55:12 +0000 2025","3","Dasco Ogah Komentari Sikap Kepala Daerah PDIP: Urusan Pak Mendagri Lah! https://t.co/B5W5gnQItq","1892875714711470577","","","in","Indonesia","0","4","1","https://x.com/geloraco/status/1892875714711470577","3319260420","geloraco"
"1892874668714930485","Fri Feb 21 09:51:03 +0000 2025","36","Bupati Brebes Tolak Instruksi Megawati Tunda Retret https://t.co/bsfrhG3znh","1892874668714930485","","","in","Indonesia","2","22","7","https://x.com/geloraco/status/1892874668714930485","3319260420","geloraco"
